{
  "$schema": "https://json-schema.org/draft/2020-12/schema",
  "$id": "stepmeld/step-definition.v1",
  "title": "A verb: what a Step takes, what it gives, how it is run by default. Holds no Values.",
  "type": "object",
  "required": ["contract", "name", "version"],
  "additionalProperties": false,
  "properties": {
    "contract": { "const": "stepmeld/step-definition.v1" },
    "name": { "$ref": "#/$defs/name" },
    "version": { "type": "integer", "minimum": 1 },
    "label": { "type": "string" },
    "description": { "type": "string" },
    "done_by": { "enum": ["performer", "person"], "default": "performer" },
    "inputs": {
      "type": "array",
      "items": {
        "type": "object", "required": ["name", "tag"], "additionalProperties": false,
        "properties": { "name": { "$ref": "#/$defs/port" }, "tag": { "$ref": "#/$defs/tag" }, "required": { "type": "boolean", "default": true }, "label": { "type": "string" } }
      }
    },
    "parameters": {
      "type": "array",
      "items": {
        "type": "object", "required": ["name", "tag"], "additionalProperties": false,
        "properties": { "name": { "$ref": "#/$defs/port" }, "tag": { "$ref": "#/$defs/tag" }, "required": { "type": "boolean", "default": false }, "default": { "description": "The verb's own default, opaque to the engine." }, "label": { "type": "string" } }
      }
    },
    "outputs": {
      "type": "array",
      "items": {
        "type": "object", "required": ["name", "tag"], "additionalProperties": false,
        "properties": { "name": { "$ref": "#/$defs/port" }, "tag": { "$ref": "#/$defs/tag" }, "options": { "type": "array", "minItems": 1, "items": { "type": "string" }, "description": "Present on a Decision (tag `decision`): the words its Value may be." }, "label": { "type": "string" } }
      }
    },
    "policy": { "$ref": "#/$defs/policy" }
  },
  "$defs": {
    "name": { "type": "string", "pattern": "^[^.\\s]+$", "description": "No dots: names are joined with ports by a dot." },
    "port": { "type": "string", "minLength": 1 },
    "tag": { "type": "string", "minLength": 1, "description": "An opaque label, compared for equality." },
    "locality": { "enum": ["this-machine", "local-network", "cloud"] },
    "policy": {
      "type": "object", "additionalProperties": false,
      "properties": {
        "start": { "enum": ["automatic", "manual"], "default": "automatic" },
        "on_failure": {
          "oneOf": [
            { "type": "object", "required": ["do"], "additionalProperties": false, "properties": { "do": { "const": "stop" } } },
            { "type": "object", "required": ["do", "max", "classes"], "additionalProperties": false, "properties": { "do": { "const": "retake" }, "max": { "type": "integer", "minimum": 0 }, "classes": { "type": "array", "items": { "type": "string" } } } }
          ]
        },
        "on_stale": { "enum": ["wait", "rerun"], "default": "wait" },
        "placement": {
          "type": "object", "additionalProperties": false,
          "properties": { "performer": { "type": "string" }, "confirm": { "type": "array", "items": { "$ref": "#/$defs/locality" } }, "anywhere": { "type": "boolean", "default": false, "description": "Where it runs does not matter: with several Performers offering the verb and none chosen, the driver that gets to it takes one and nobody is asked." } }
        }
      }
    }
  }
}
