{
  "contract": "stepmeld/step-definition.v1",
  "done_by": "person",
  "inputs": [
    {
      "name": "model",
      "required": true,
      "tag": "sparse-model"
    }
  ],
  "name": "review-solve",
  "outputs": [
    {
      "name": "decision",
      "options": [
        "accept",
        "refine"
      ],
      "tag": "decision"
    }
  ],
  "parameters": [],
  "policy": {
    "on_failure": {
      "do": "stop"
    },
    "on_stale": "wait",
    "placement": {},
    "start": "automatic"
  },
  "version": 1
}
