{
  "contract": "stepmeld/step-definition.v1",
  "done_by": "performer",
  "inputs": [
    {
      "name": "a",
      "required": true,
      "tag": "integer"
    },
    {
      "name": "b",
      "required": true,
      "tag": "integer"
    }
  ],
  "label": "Add two integers",
  "name": "add",
  "outputs": [
    {
      "name": "sum",
      "tag": "integer"
    }
  ],
  "parameters": [
    {
      "default": 1,
      "name": "beat-seconds",
      "required": false,
      "tag": "number"
    }
  ],
  "policy": {
    "on_failure": {
      "do": "stop"
    },
    "on_stale": "wait",
    "placement": {},
    "start": "automatic"
  },
  "version": 1
}
